"gene","ENTREZID","product","ensembl_gene_id","external_synonym","chromosome_name","gene_biotype","phenotype_description","hsapiens_homolog_associated_gene_name"
"Plch2",269615,"phospholipase C, eta 2, transcript variant 2","ENSMUSG00000029055","A930027K05Rik","4","protein_coding","no abnormal phenotype detected","PLCH2"
"Pde11a",241489,"phosphodiesterase 11A, transcript variant X2","ENSMUSG00000075270","6330414F14Rik","2","protein_coding","abnormal eye morphology","PDE11A"
"Zfp335",329559,"zinc finger protein 335, transcript variant X2","ENSMUSG00000039834","1810045J01Rik","2","protein_coding","abnormal CD4-positive T cell differentiation","ZNF335"
"Gpr61",229714,"G protein-coupled receptor 61","ENSMUSG00000046793",NA,"3","protein_coding","abnormal bone structure","GPR61"
"Tox",252838,"thymocyte selection-associated high mobility group box, transcript variant X2","ENSMUSG00000041272","1700007F02Rik","4","protein_coding","abnormal auditory brainstem response","TOX"
"Gabrr1",14408,"gamma-aminobutyric acid (GABA) C receptor, subunit rho 1, transcript variant X8","ENSMUSG00000028280","GABA-C","4","protein_coding","abnormal mechanical nociception","GABRR1"
"Jun",16476,"jun proto-oncogene","ENSMUSG00000052684","c-jun","4","protein_coding","abnormal blood vessel morphology","JUN"
"Cox7b2",78174,"cytochrome c oxidase subunit VIIb2","ENSMUSG00000049387","4930503B16Rik","5","protein_coding",NA,"COX7B2"
"Mn1",433938,"meningioma 1","ENSMUSG00000070576",NA,"5","protein_coding","abnormal cranial suture morphology","MN1"
"Tmem130",243339,"transmembrane protein 130","ENSMUSG00000043388",NA,"5","protein_coding",NA,"TMEM130"
"Dusp11",72102,"dual specificity phosphatase 11 (RNA/RNP complex 1-interacting)","ENSMUSG00000030002","2010300F21Rik","6","protein_coding","abnormal cornea morphology","DUSP11"
"Tmem91",320208,"transmembrane protein 91, transcript variant X1","ENSMUSG00000061702","A830041P22Rik","7","protein_coding",NA,"TMEM91"
"Rbms2",56516,"RNA binding motif, single stranded interacting protein 2, transcript variant X2","ENSMUSG00000040043","2610315E04Rik","10","protein_coding",NA,"RBMS2"
"Inpp5j",170835,"inositol polyphosphate 5-phosphatase J","ENSMUSG00000034570","Pib5pa","11","protein_coding","abnormal skin morphology","INPP5J"
"Vstm2a",211739,"V-set and transmembrane domain containing 2A, transcript variant X1","ENSMUSG00000048834","9330184N17Rik","11","protein_coding","abnormal kidney morphology","VSTM2A"
"C1qtnf2",69183,"C1q and tumor necrosis factor related protein 2, transcript variant X1","ENSMUSG00000046491","1810033K05Rik","11","protein_coding","increased prepulse inhibition","C1QTNF2"
"Ctns",83429,"cystinosis, nephropathic","ENSMUSG00000005949",NA,"11","protein_coding","abnormal eye electrophysiology","CTNS"
"Smarcd2",83796,"SWI/SNF related, matrix associated, actin dependent regulator of chromatin, subfamily d, member 2, transcript variant 1","ENSMUSG00000078619","Baf60b","11","protein_coding","decreased circulating alanine transaminase level","SMARCD2"
"Dbpht2",386753,"DNA binding protein with his-thr domain","ENSMUSG00000029878","Spot2","12","lncRNA","decreased bone mineral density",NA
"Ltbp2",16997,"latent transforming growth factor beta binding protein 2, transcript variant X3","ENSMUSG00000002020",NA,"12","protein_coding","abnormal QT variability","LTBP2"
"Drd1",13488,"dopamine receptor D1, transcript variant 1","ENSMUSG00000021478","C030036C15Rik","13","protein_coding","abnormal behavior","DRD1"
"Dact2",240025,"dapper homolog 2, antagonist of beta-catenin (xenopus), transcript variant X1","ENSMUSG00000048826","2900084M21Rik","17","protein_coding","abnormal coat/ hair morphology","DACT2"
"E4f1",13560,"E4F transcription factor 1, transcript variant 2","ENSMUSG00000024137",NA,"17","protein_coding","abnormal apoptosis","E4F1"
"Zfp598",213753,"zinc finger protein 598, transcript variant X1","ENSMUSG00000041130",NA,"17","protein_coding",NA,"ZNF598"
"Zcchc12",72693,"zinc finger, CCHC domain containing 12","ENSMUSG00000036699","2810028A01Rik","X","protein_coding",NA,"ZCCHC12"
"Zfp263",74120,"zinc finger protein 263","ENSMUSG00000022529","1200014J04Rik","16","protein_coding",NA,"ZNF263"
"Tspyl3",241732,"TSPY-like 3","ENSMUSG00000074671","LOC241732","2","protein_coding",NA,NA
"Arhgap10",78514,"Rho GTPase activating protein 10, transcript variant X5","ENSMUSG00000037148","A930033B01Rik","8","protein_coding","abnormal bone structure","ARHGAP10"
"Plxnb2",140570,"plexin B2, transcript variant 3","ENSMUSG00000036606","1110007H23Rik","15","protein_coding","abnormal response to tactile stimuli","PLXNB2"
"Doc2a",13446,"double C2, alpha, transcript variant X3","ENSMUSG00000052301",NA,"7","protein_coding","abnormal passive avoidance behavior","DOC2A"
"Tmem29",382245,"transmembrane protein 29, transcript variant 1","ENSMUSG00000041353","2700081K05Rik","X","protein_coding",NA,"FAM156B"
"Dpf2",19708,"D4, zinc and double PHD fingers family 2, transcript variant 2","ENSMUSG00000024826","2210010M07Rik","19","protein_coding","abnormal craniofacial morphology","DPF2"
"Foxl2os",768252,"forkhead box L2, opposite strand","ENSMUSG00000097072","ENSMUSG00000074122","9","lncRNA",NA,NA
"Slc47a1",67473,"solute carrier family 47, member 1, transcript variant X1","ENSMUSG00000010122","1300013J15Rik","11","protein_coding","abnormal lens morphology","SLC47A1"
"Nap1l5",58243,"nucleosome assembly protein 1-like 5","ENSMUSG00000055430","1110020M21Rik","6","protein_coding",NA,"NAP1L5"
"Mapk7",23939,"mitogen-activated protein kinase 7, transcript variant X1","ENSMUSG00000001034","b2b2346Clo","11","protein_coding","abnormal angiogenesis","MAPK7"
"Grem2",23893,"gremlin 2 homolog, cysteine knot superfamily (Xenopus laevis)","ENSMUSG00000050069","Prdc","1","protein_coding","dilated heart left ventricle","GREM2"
"Pcdh10",18526,"protocadherin 10, transcript variant 1","ENSMUSG00000049100","6430521D13Rik","3","protein_coding","abnormal gait","PCDH10"
"Nol3",78688,"nucleolar protein 3 (apoptosis repressor with CARD domain), transcript variant X1","ENSMUSG00000014776","ARC","8","protein_coding","abnormal lymph node morphology","NOL3"
"Gpr83",14608,"G protein-coupled receptor 83, transcript variant X1","ENSMUSG00000031932","GIR","9","protein_coding","decreased CD4-positive alpha beta T cell number","GPR83"
"Nrsn2",228777,"neurensin 2, transcript variant X1","ENSMUSG00000059361","LOC228777","2","protein_coding","decreased circulating creatine kinase level","NRSN2"
"Prss16",54373,"protease, serine 16 (thymus)","ENSMUSG00000006179","TSSP","13","protein_coding","abnormal professional antigen presenting cell morphology","PRSS16"
"Pcdh18",73173,"protocadherin 18, transcript variant X1","ENSMUSG00000037892","PCDH68L","3","protein_coding","corneal opacity","PCDH18"
"Emx2",13797,"empty spiracles homeobox 2, transcript variant X1","ENSMUSG00000043969","Pdo","19","protein_coding","Wolffian duct degeneration","EMX2"
"Ccdc81",70884,"coiled-coil domain containing 81","ENSMUSG00000039391","4921513D09Rik","7","protein_coding",NA,"CCDC81"
"Rwdd2a",69519,"RWD domain containing 2A, transcript variant 3","ENSMUSG00000032417","1700030C20Rik","9","protein_coding","decreased bone mineral content","RWDD2A"
"Mpped1",223726,"metallophosphoesterase domain containing 1, transcript variant X3","ENSMUSG00000041708",NA,"15","protein_coding",NA,"MPPED1"
"Galnt7",108150,"UDP-N-acetyl-alpha-D-galactosamine: polypeptide N-acetylgalactosaminyltransferase 7, transcript variant 1","ENSMUSG00000031608","ppGaNTase-T7","8","protein_coding",NA,"GALNT7"
"S100a8",20201,"S100 calcium binding protein A8 (calgranulin A)","ENSMUSG00000056054","60B8Ag","3","protein_coding","abnormal embryonic tissue morphology","S100A8"
"Mau2",74549,"MAU2 chromatid cohesion factor homolog (C. elegans), transcript variant X1","ENSMUSG00000031858","9130404D08Rik","8","protein_coding","abnormal lens morphology","MAU2"
"Ptpn23",104831,"protein tyrosine phosphatase, non-receptor type 23, transcript variant X1","ENSMUSG00000036057","PTP-TD14","9","protein_coding","increased circulating HDL cholesterol level","PTPN23"
"Sstr1",20605,"somatostatin receptor 1, transcript variant X1","ENSMUSG00000035431","Smstr-1","12","protein_coding","abnormal brain wave pattern","SSTR1"
"Wdfy4",545030,"WD repeat and FYVE domain containing 4","ENSMUSG00000051506",NA,"14","protein_coding",NA,"WDFY4"
"Anxa3",11745,"annexin A3","ENSMUSG00000029484","Anx3","5","protein_coding",NA,"ANXA3"
"C3",12266,"complement component 3, transcript variant X1","ENSMUSG00000024164","acylation stimulating protein","17","protein_coding","abnormal motor learning","C3"
"Tead4",21679,"TEA domain family member 4, transcript variant 2","ENSMUSG00000030353","ETFR-2a","6","protein_coding","abnormal morula morphology","TEAD4"
"Clvs2",215890,"clavesin 2, transcript variant X1","ENSMUSG00000019785","A330019N05Rik","10","protein_coding",NA,"CLVS2"
"Gaa",14387,"glucosidase, alpha, acid, transcript variant 2","ENSMUSG00000025579","E430018M07Rik","11","protein_coding","abnormal QRS complex","GAA"
"Zfp219",69890,"zinc finger protein 219, transcript variant 3","ENSMUSG00000049295","2010302A17Rik","14","protein_coding","increased bone mineral density","ZNF219"
"Bves",23828,"blood vessel epicardial substance","ENSMUSG00000071317","Popdc1","10","protein_coding","abnormal skin morphology","BVES"
"Tmem161a",234371,"transmembrane protein 161A, transcript variant X5","ENSMUSG00000002342",NA,"8","protein_coding",NA,"TMEM161A"
"Unc5d",210801,"unc-5 homolog D (C. elegans)","ENSMUSG00000063626","D930029E11Rik","8","protein_coding","abnormal axon extension","UNC5D"
"Cd180",17079,"CD180 antigen","ENSMUSG00000021624","Ly78","13","protein_coding","abnormal humoral immune response","CD180"
"Scml4",268297,"sex comb on midleg-like 4 (Drosophila), transcript variant X3","ENSMUSG00000044770",NA,"10","protein_coding",NA,"SCML4"
"Stk38",106504,"serine/threonine kinase 38, transcript variant X2","ENSMUSG00000024006","5830476G13Rik","17","protein_coding","abnormal auditory brainstem response","STK38"
"Sox17",20671,"SRY (sex determining region Y)-box 17, transcript variant 5","ENSMUSG00000025902",NA,"1","protein_coding","abnormal bile duct development","SOX17"
"Srsf9",108014,"serine/arginine-rich splicing factor 9, transcript variant X1","ENSMUSG00000029538","2610029M16Rik","5","protein_coding","hyperactivity","SRSF9"
"Herpud1",64209,"homocysteine-inducible, endoplasmic reticulum stress-inducible, ubiquitin-like domain member 1, transcript variant X1","ENSMUSG00000031770","Herp","8","protein_coding","decreased cerebral infarction size","HERPUD1"
"Hmbs",15288,"hydroxymethylbilane synthase, transcript variant 1","ENSMUSG00000032126","PBGD","9","protein_coding","abnormal lens morphology","HMBS"
"Gm2824",100040529,"predicted gene 2824, transcript variant X13","ENSMUSG00000097452",NA,"15","lncRNA",NA,NA
"Mir1901",100316686,"microRNA 1901","ENSMUSG00000084565","Mirn1901","18","miRNA",NA,NA
"Adamts19",240322,"a disintegrin-like and metallopeptidase (reprolysin type) with thrombospondin type 1 motif, 19, transcript variant X1","ENSMUSG00000053441","D230034E10Rik","18","protein_coding","decreased circulating glucose level","ADAMTS19"
"Zfp36l1",12192,"zinc finger protein 36, C3H type-like 1","ENSMUSG00000021127","Brf1","12","protein_coding","abnormal angiogenesis","ZFP36L1"
"Impact",16210,"impact, RWD domain protein, transcript variant X3","ENSMUSG00000024423","E430016J11Rik","18","protein_coding",NA,"IMPACT"
"Trmt6",66926,"tRNA methyltransferase 6, transcript variant X2","ENSMUSG00000037376","3300001M20Rik","2","protein_coding",NA,"TRMT6"
"Plekhm1",353047,"pleckstrin homology domain containing, family M (with RUN domain) member 1","ENSMUSG00000034247","AP162","11","protein_coding","abnormal optic disk morphology","PLEKHM1"
"Basp1",70350,"brain abundant, membrane attached signal protein 1","ENSMUSG00000045763","2610024P12Rik","15","protein_coding","abnormal Schwann cell morphology","BASP1"
"Grid1",14803,"glutamate receptor, ionotropic, delta 1, transcript variant X1","ENSMUSG00000041078","GluRdelta1","14","protein_coding","abnormal auditory brainstem response","GRID1"
"Zdbf2",73884,"zinc finger, DBF-type containing 2, transcript variant 3","ENSMUSG00000027520","4930431J08Rik","1","protein_coding","abnormal DNA methylation","ZDBF2"
"Tal1",21349,"T cell acute lymphocytic leukemia 1, transcript variant 1","ENSMUSG00000028717","bHLHa17","4","protein_coding","abnormal blood vessel morphology","TAL1"
"Raf1",110157,"v-raf-leukemia viral oncogene 1","ENSMUSG00000000441","6430402F14Rik","6","protein_coding","abnormal lens morphology","RAF1"
"Pgpep1l",78444,"pyroglutamyl-peptidase I-like, transcript variant X1","ENSMUSG00000030553","C330024D12Rik","7","protein_coding",NA,"PGPEP1L"
"Fzd4",14366,"frizzled homolog 4 (Drosophila)","ENSMUSG00000049791","Fz4","7","protein_coding","edema","FZD4"
"Tfdp1",21781,"transcription factor Dp 1, transcript variant 2","ENSMUSG00000038482","Dp1","8","protein_coding","decreased embryo size","TFDP1"
"Pdzrn4",239618,"PDZ domain containing RING finger 4, transcript variant 1","ENSMUSG00000036218","1110017D07Rik","15","protein_coding",NA,"PDZRN4"
"Ier3",15937,"immediate early response 3","ENSMUSG00000003541","cAMP inducible gene 3","17","protein_coding","abnormal CD4-positive alpha-beta T cell physiology","IER3"
"Mir378a",723889,"microRNA 378a","ENSMUSG00000105200","Mirn378","18","miRNA","abnormal mitochondrial physiology","MIR378A"
"Magee2",272790,"melanoma antigen, family E, 2","ENSMUSG00000031224","9630059J11Rik","X","protein_coding",NA,"MAGEE2"
"Plekhg2",101497,"pleckstrin homology domain containing, family G (with RhoGef domain) member 2, transcript variant X3","ENSMUSG00000037552","Clg","7","protein_coding","increased bone mineral density","PLEKHG2"
"Boc",117606,"biregional cell adhesion molecule-related/down-regulated by oncogenes (Cdon) binding protein","ENSMUSG00000022687",NA,"16","protein_coding","decreased bone mineral content","BOC"
"Ddx39b",53817,"DEAD (Asp-Glu-Ala-Asp) box polypeptide 39B, transcript variant 1","ENSMUSG00000019432","0610030D10Rik","17","protein_coding","increased cellular sensitivity to gamma-irradiation","DDX39B"
"H2-T24",15042,"histocompatibility 2, T region locus 24, transcript variant X3","ENSMUSG00000053835","H-2T24","17","protein_coding","decreased circulating free fatty acids level","HLA-E"
"Insm1",53626,"insulinoma-associated 1","ENSMUSG00000068154","IA-1","2","protein_coding","abnormal endocrine pancreas development","INSM1"
"Vstm5",69137,"V-set and transmembrane domain containing 5, transcript variant X1","ENSMUSG00000031937","2200002K05Rik","9","protein_coding","decreased interleukin-2 secretion","VSTM5"
"Kctd4",67516,"potassium channel tetramerisation domain containing 4","ENSMUSG00000046523","2210017A09Rik","14","protein_coding",NA,"KCTD4"
"Oprm1",18390,"opioid receptor, mu 1, transcript variant MOR-1M","ENSMUSG00000000766","MOP receptor","10","protein_coding","abnormal behavioral response to addictive substance","OPRM1"
"Zfand6",65098,"zinc finger, AN1-type domain 6, transcript variant X5","ENSMUSG00000030629","3110005P07Rik","7","protein_coding","abnormal kidney morphology","ZFAND6"
"Cx3cl1",20312,"chemokine (C-X3-C motif) ligand 1","ENSMUSG00000031778","CX3C","8","protein_coding","decreased cornea thickness","CX3CL1"
"Tacr3",21338,"tachykinin receptor 3","ENSMUSG00000028172","neuromedin K receptor","3","protein_coding","decreased grip strength","TACR3"
"Gpr4",319197,"G protein-coupled receptor 4, transcript variant X1","ENSMUSG00000044317",NA,"7","protein_coding","abnormal angiogenesis","GPR4"
"Ptgis",19223,"prostaglandin I2 (prostacyclin) synthase, transcript variant X1","ENSMUSG00000017969","Cyp8a1","2","protein_coding","abnormal brain morphology","PTGIS"
"Ccdc28a",215814,"coiled-coil domain containing 28A","ENSMUSG00000059554","1700009P13Rik","10","protein_coding","abnormal iris pigmentation","CCDC28A"
"Ido2",209176,"indoleamine 2,3-dioxygenase 2, transcript variant X1","ENSMUSG00000031549","C230043N17Rik","8","protein_coding","process of degenerative change","IDO2"
"Elfn2",207393,"leucine rich repeat and fibronectin type III, extracellular 2, transcript variant X1","ENSMUSG00000043460","Lrrc62","15","protein_coding","abnormal behavior","ELFN2"
"Ngp",18054,"neutrophilic granule protein","ENSMUSG00000032484","bectenecin","9","protein_coding","corneal opacity",NA
"Ptpro",19277,"protein tyrosine phosphatase, receptor type, O, transcript variant 1","ENSMUSG00000030223","D28","6","protein_coding","abnormal cardiovascular system physiology","PTPRO"
"Neto1",246317,"neuropilin (NRP) and tolloid (TLL)-like 1, transcript variant X1","ENSMUSG00000050321","C130005O10Rik","18","protein_coding","abnormal acid-activated cation-mediated receptor currents","NETO1"
"Col6a2",12834,"collagen, type VI, alpha 2","ENSMUSG00000020241","Col6a-2","10","protein_coding","decreased grip strength","COL6A2"
"Fev",260298,"FEV (ETS oncogene family)","ENSMUSG00000055197","mPet-1","1","protein_coding","abnormal neuron differentiation","FEV"
"Mmab",77697,"methylmalonic aciduria (cobalamin deficiency) type B homolog (human)","ENSMUSG00000029575","9130222L19Rik","5","protein_coding",NA,"MMAB"
"Resp18",19711,"regulated endocrine-specific protein 18, transcript variant X1","ENSMUSG00000033061",NA,"1","protein_coding","decreased fasting circulating glucose level","RESP18"
"Amn",93835,"amnionless","ENSMUSG00000021278","5033428N14Rik","12","protein_coding","abnormal ectoderm development","AMN"
"Tmem132b",208151,"transmembrane protein 132B","ENSMUSG00000070498",NA,"5","protein_coding","abnormal cholesterol homeostasis","TMEM132B"
"St6gal2",240119,"beta galactoside alpha 2,6 sialyltransferase 2, transcript variant X5","ENSMUSG00000024172","C230064G14Rik","17","protein_coding","long tibia","ST6GAL2"
"Tbc1d25",209815,"TBC1 domain family, member 25, transcript variant X1","ENSMUSG00000039201","6330576A08Rik","X","protein_coding","cardiac fibrosis","TBC1D25"
"Pdcd2l",68079,"programmed cell death 2-like","ENSMUSG00000002635","6030457N17Rik","7","protein_coding",NA,NA
"Acot3",171281,"acyl-CoA thioesterase 3, transcript variant X2","ENSMUSG00000021228","PTE-Ia","12","protein_coding","abnormal eye morphology","ACOT1"
"Gm5468",432939,"predicted gene 5468","ENSMUSG00000056089","100040583","15","lncRNA",NA,NA
"Atg16l1",77040,"autophagy related 16-like 1 (S. cerevisiae), transcript variant X2","ENSMUSG00000026289","1500009K01Rik","1","protein_coding","increased circulating serum albumin level","ATG16L1"
"Rpl14-ps1",100040970,"ribosomal protein L14, pseudogene 1","ENSMUSG00000046721","Gm9811","7","processed_pseudogene",NA,NA
"Glra3",110304,"glycine receptor, alpha 3 subunit, transcript variant X1","ENSMUSG00000038257",NA,"8","protein_coding","abnormal eye physiology","GLRA3"
"Plekhh3",217198,"pleckstrin homology domain containing, family H (with MyTH4 domain) member 3, transcript variant X6","ENSMUSG00000035172",NA,"11","protein_coding",NA,"PLEKHH3"
"Pcdhga1",93709,"protocadherin gamma subfamily A, 1","ENSMUSG00000103144",NA,"18","protein_coding","no abnormal phenotype detected","PCDHGA1"
"Gm9899",100502829,"predicted gene 9899","ENSMUSG00000053214",NA,"5","lncRNA",NA,NA
"Eps8l1",67425,"EPS8-like 1, transcript variant X8","ENSMUSG00000006154","2310051G19Rik","7","protein_coding","decreased pulmonary ventilation","EPS8L1"
"Serpina3g",20715,"serine (or cysteine) peptidase inhibitor, clade A, member 3G","ENSMUSG00000041481","2A2","12","protein_coding","abnormal memory T cell morphology","SERPINA3"
"Pcdh17",219228,"protocadherin 17, transcript variant X1","ENSMUSG00000035566","C030033F14Rik","14","protein_coding","abnormal paired-pulse inhibition","PCDH17"
"Riok3",66878,"RIO kinase 3","ENSMUSG00000024404","1200013N13Rik","18","protein_coding",NA,"RIOK3"
"Dcaf12l2",245403,"DDB1 and CUL4 associated factor 12-like 2","ENSMUSG00000050926","A130007F10Rik","X","protein_coding",NA,"DCAF12L2"
"Ankrd6",140577,"ankyrin repeat domain 6, transcript variant X2","ENSMUSG00000040183","diversin","4","protein_coding","abnormal vestibular hair cell morphology","ANKRD6"
"Dhrs11",192970,"dehydrogenase/reductase (SDR family) member 11, transcript variant X2","ENSMUSG00000034449",NA,"11","protein_coding",NA,"DHRS11"
"Zdhhc22",238331,"zinc finger, DHHC-type containing 22, transcript variant X2","ENSMUSG00000048483","LOC238331","12","protein_coding",NA,"ZDHHC22"
"Hmgb3",15354,"high mobility group box 3, transcript variant 1","ENSMUSG00000015217","Hmg2a","X","protein_coding","abnormal common lymphocyte progenitor cell morphology","HMGB3"
"Mid1",17318,"midline 1, transcript variant 6","ENSMUSG00000035299","61B3-R","X","protein_coding","abnormal axon morphology","MID1"
"Celf3",78784,"CUGBP, Elav-like family member 3, transcript variant X10","ENSMUSG00000028137","4930415M08Rik","3","protein_coding","abnormal sperm motility","CELF3"
"Akap5",238276,"A kinase (PRKA) anchor protein 5, transcript variant X1","ENSMUSG00000021057","3526401B18Rik","12","protein_coding","abnormal AMPA-mediated synaptic currents","AKAP5"
"Phlda3",27280,"pleckstrin homology-like domain, family A, member 3","ENSMUSG00000041801","TDAG/lpl homolog 1","1","protein_coding",NA,"PHLDA3"
"Arfgap2",77038,"ADP-ribosylation factor GTPase activating protein 2, transcript variant 1","ENSMUSG00000027255","2310032E02Rik","2","protein_coding",NA,"ARFGAP2"
"Gabpb1",14391,"GA repeat binding protein, beta 1, transcript variant 7","ENSMUSG00000027361","BABPB2","2","protein_coding","embryonic lethality during organogenesis complete penetrance","GABPB1"
"Mybpc1",109272,"myosin binding protein C, slow-type, transcript variant X4","ENSMUSG00000020061","8030451F13Rik","10","protein_coding",NA,"MYBPC1"
"Nfkbia",18035,"nuclear factor of kappa light polypeptide gene enhancer in B cells inhibitor, alpha","ENSMUSG00000021025","I(Kappa)B(alpha)","12","protein_coding","abnormal B cell differentiation","NFKBIA"
"Gabra3",14396,"gamma-aminobutyric acid (GABA) A receptor, subunit alpha 3","ENSMUSG00000031343","Gabra-3","X","protein_coding","abnormal GABA-mediated receptor currents","GABRA3"
"Gtpbp2",56055,"GTP binding protein 2, transcript variant X1","ENSMUSG00000023952","nmf205","17","protein_coding","enlarged lymph nodes","GTPBP2"
"Ptgdr",19214,"prostaglandin D receptor","ENSMUSG00000071489","DP","14","protein_coding","decreased basophil cell number","PTGDR"
"Myh15",667772,"myosin, heavy chain 15","ENSMUSG00000092009","EG667772","16","protein_coding",NA,"MYH15"
"Ciz1",68379,"CDKN1A interacting zinc finger protein 1, transcript variant X16","ENSMUSG00000039205","0610038H21Rik","2","protein_coding","decreased body size","CIZ1"
"Tmem62",96957,"transmembrane protein 62, transcript variant X1","ENSMUSG00000054484","B830009D23Rik","2","protein_coding","decreased grip strength","TMEM62"
"Pan3",72587,"PAN3 polyA specific ribonuclease subunit homolog (S. cerevisiae), transcript variant X3","ENSMUSG00000029647","2700050F09Rik","5","protein_coding","abnormal skin morphology","PAN3"
"Pld3",18807,"phospholipase D family, member 3, transcript variant X3","ENSMUSG00000003363","Sam-9","7","protein_coding","decreased circulating glucose level","PLD3"
"Trim3",55992,"tripartite motif-containing 3, transcript variant 4","ENSMUSG00000036989","BERP1","7","protein_coding","abnormal retinal outer nuclear layer morphology","TRIM3"
"Spata2l",78779,"spermatogenesis associated 2-like, transcript variant X2","ENSMUSG00000033594","2610039E05Rik","8","protein_coding",NA,"SPATA2L"
"Gm2223",100039419,NA,"ENSMUSG00000079297",NA,"X","processed_pseudogene",NA,NA
"Dnah1",110084,"dynein, axonemal, heavy chain 1","ENSMUSG00000019027","B230373P09Rik","14","protein_coding","abnormal coat appearance","DNAH1"
"Pnoc",18155,"prepronociceptin, transcript variant 2","ENSMUSG00000045731","N/OFQ","14","protein_coding","abnormal mechanical nociception","PNOC"
"Dzank1",241688,"double zinc ribbon and ankyrin repeat domains 1, transcript variant X3","ENSMUSG00000037259","2810039F03Rik","2","protein_coding","decreased circulating insulin level","DZANK1"
"Safb2",224902,"scaffold attachment factor B2, transcript variant X2","ENSMUSG00000042625",NA,"17","protein_coding","abnormal bone structure","SAFB2"
"Rnf128",66889,"ring finger protein 128, transcript variant 2","ENSMUSG00000031438","1300002C13Rik","X","protein_coding","abnormal urinary bladder morphology","RNF128"
"Jpx",70252,"Jpx transcript, Xist activator (non-protein coding)","ENSMUSG00000097571","2010000I03Rik","X","lncRNA",NA,NA
"Il16",16170,"interleukin 16, transcript variant X1","ENSMUSG00000001741",NA,"7","protein_coding","abnormal T cell physiology","IL16"
"Slc26a7",208890,"solute carrier family 26, member 7, transcript variant X2","ENSMUSG00000040569",NA,"4","protein_coding","abnormal digestive system physiology","SLC26A7"
"Rspo1",192199,"R-spondin homolog (Xenopus laevis), transcript variant X1","ENSMUSG00000028871","R-spondin","4","protein_coding","abnormal eye anterior chamber depth","RSPO1"
"Hcfc2",67933,"host cell factor C2, transcript variant X9","ENSMUSG00000020246","1700129L13Rik","10","protein_coding","abnormal innate immunity","HCFC2"
"Gm35315",102638847,"predicted gene, 35315, transcript variant X1","ENSMUSG00000109771","Gm20090","5","protein_coding",NA,NA
"Tyrp1",22178,"tyrosinase-related protein 1, transcript variant X1","ENSMUSG00000005994","isa","4","protein_coding","abnormal behavior","TYRP1"
"Pank4",269614,"pantothenate kinase 4, transcript variant X1","ENSMUSG00000029056","D030031I12Rik","4","protein_coding","abnormal lens epithelium morphology","PANK4"
"Ngef",53972,"neuronal guanine nucleotide exchange factor, transcript variant 1","ENSMUSG00000026259","ephexin","1","protein_coding","abnormal axon extension","NGEF"
"Llgl1",16897,"lethal giant larvae homolog 1 (Drosophila), transcript variant X1","ENSMUSG00000020536","Lgl1","11","protein_coding","abnormal brain vasculature morphology","LLGL1"
"Usp12",22217,"ubiquitin specific peptidase 12","ENSMUSG00000029640","Ubh1","5","protein_coding","abnormal urination","USP12"
